{
  "$schema": "./chaser-card.schema.json",
  "id": "CHASER-0001",
  "slug": "log4shell",
  "title": "Log4Shell",
  "subtitle": "Apache Log4j JNDI Exploitation",
  "version": "1.0.0",
  "status": "active",
  "created": "2026-06-19",
  "updated": "2026-06-21",
  "author": {
    "name": "Richard Vallejo",
    "website": "https://richardvallejo.com"
  },
  "license": "CC BY 4.0",
  "branding": {
    "series": "CHASER Cards",
    "repository": "https://github.com/richvallejo/chaser-cards"
  },
  "chaser_model": {
    "version": "2026-06-18",
    "source": "https://richardvallejo.com/chaser.html",
    "stage_questions": {
      "context": "What are we hunting for, and why does it matter?",
      "hypothesis": "What do we believe may be happening in the environment?",
      "analyze": "What evidence do we need to examine?",
      "strategize": "How are we going to run the hunt?",
      "execute": "What do we do with what we found?",
      "review": "What did we learn, and what should change?"
    },
    "stage_purposes": {
      "context": "Relevant CVEs, techniques, affected systems, known behaviors, likely impact, and indicators.",
      "hypothesis": "A testable statement that identifies likely behavior, affected environment, and evidence that would support or challenge the hunt.",
      "analyze": "Telemetry and evidence sources needed to confirm, weaken, or disprove the hypothesis, including visibility gaps.",
      "strategize": "Scope, time window, affected assets, search logic, pivots, enrichment, expected results, false positives, and decision points.",
      "execute": "Finding-based actions such as documenting results, remediation, escalation, detection tuning, reporting, or incident response.",
      "review": "Lessons learned and improvements to detections, controls, telemetry, documentation, playbooks, and future hunt cards."
    }
  },
  "mitre_attack": [
    {
      "id": "T1190",
      "name": "Exploit Public-Facing Application",
      "tactic": "Initial Access"
    }
  ],
  "categories": [
    "Public-Facing Exploit",
    "Vulnerability"
  ],
  "image": "CHASER-0001-log4shell.png",
  "json": "json/CHASER-0001-log4shell.json",
  "tool_requirements": [
    {
      "category": "VULNERABILITY_MANAGEMENT",
      "capabilities": [
        "asset_vulnerability_lookup",
        "software_inventory"
      ]
    },
    {
      "category": "SIEM",
      "capabilities": [
        "log_query",
        "correlation_search"
      ]
    },
    {
      "category": "DNS",
      "capabilities": [
        "domain_lookup_history"
      ]
    },
    {
      "category": "NETWORK",
      "capabilities": [
        "outbound_connection_search"
      ]
    },
    {
      "category": "EDR",
      "capabilities": [
        "process_search",
        "file_search"
      ]
    },
    {
      "category": "ENDPOINT_ASSET_INVENTORY",
      "capabilities": [
        "asset_inventory"
      ]
    }
  ],
  "content": {
    "threat_summary": "Log4Shell: Apache Log4j JNDI Exploitation",
    "context": [
      "Apache Log4j 2 is a Java logging library. Log4Shell (CVE-2021-44228) enables RCE through unsafe JNDI lookup behavior in log4j-core.",
      "Affected: log4j-core 2.0-beta9 through 2.14.1. log4j-api alone is not affected.",
      "Related: CVE-2021-45046 and CVE-2021-45105.",
      "Indicators: ${jndi:ldap://, ${jndi:rmi://, ${jndi:dns://, encoded variants, unexpected outbound callbacks."
    ],
    "hypothesis": [
      "A threat actor attempted to exploit a vulnerable public-facing Java application with Log4Shell, causing suspicious JNDI lookup strings, outbound callbacks, or follow-on host execution."
    ],
    "analyze": [
      "Vulnerability and software inventory for Java applications, containers, and vendor products showing log4j-core package name, path, version, and internet exposure.",
      "Raw web, application, WAF, reverse-proxy, and load balancer logs with URLs, headers, user agents, referrers, and request bodies for JNDI strings or encoded variants.",
      "DNS, proxy, firewall, and flow telemetry showing outbound LDAP, RMI, DNS, IIOP, NIS, or HTTP/S callbacks from application servers.",
      "EDR telemetry for java/javaw child processes, outbound connections, file writes, webroot changes, webshell indicators, service accounts, and persistence.",
      "Visibility gaps such as missing request-body logging, egress blind spots, container inventory gaps, or no EDR on application hosts."
    ],
    "strategize": [
      "Scope internet-facing Java applications, vendor appliances, containers, and hosts with log4j-core 2.0-beta9 through 2.14.1.",
      "Use a lookback from 2021-12-01 through patch date or current exposure; narrow pivots around attempts by +/-30 minutes and host review by 24 hours.",
      "Query inbound logs for literal, encoded, and obfuscated JNDI payloads in URLs, headers, user agents, referrers, and bodies; normalize WAF/proxy source fields.",
      "Pivot each hit to target exposure, source reputation, callback DNS/proxy/firewall activity, then EDR process and file telemetry.",
      "Decision points: no vulnerable asset, exposure only, attempt without callback, callback without execution, execution or persistence, or telemetry gap."
    ],
    "execute": {
      "prevention": [
        "Upgrade Java 8+ environments to Log4j 2.17.0 or later; Java 7 to 2.12.3 or later; prefer the latest supported release.",
        "If patching is delayed, isolate exposed systems and remove or disable JndiLookup.class per vendor guidance.",
        "Restrict outbound LDAP/RMI from application servers and validate WAF and egress controls."
      ],
      "escalation": [
        "Escalate to IR if exploit attempts correlate with outbound callbacks, suspicious Java child processes, file drops, or webshells.",
        "Map primary activity to MITRE ATT&CK T1190: Exploit Public-Facing Application."
      ],
      "finding_actions": [
        {
          "finding": "No evidence",
          "action": "Document the scoped assets, searched data sources, time window, and negative results; keep scheduled patch and detection validation work."
        },
        {
          "finding": "Exposure only",
          "action": "Remediate or mitigate vulnerable log4j-core, confirm owner and patch deadline, restrict risky egress, and monitor for new attempts."
        },
        {
          "finding": "Suspicious activity",
          "action": "Escalate for triage when inbound JNDI attempts align with callbacks, unusual source behavior, or weak host evidence; preserve logs and enrich indicators."
        },
        {
          "finding": "Confirmed compromise",
          "action": "Open incident response, preserve forensic evidence, contain through approved channels, eradicate dropped artifacts, and validate patching before recovery."
        },
        {
          "finding": "Telemetry gap",
          "action": "Record the missing visibility, assign an owner, add or tune collection for web requests, egress, inventory, or EDR, and rerun the hunt when available."
        }
      ]
    },
    "review": [
      "Capture which detections found JNDI payloads, callbacks, Java child processes, file drops, and webshell indicators, and note missed coverage.",
      "Convert validated search logic into durable SIEM, EDR, WAF, and egress detections for literal, encoded, and obfuscated payload variants.",
      "Close telemetry gaps for request body/header logging, DNS/proxy/firewall egress, software inventory, container images, and EDR on Java servers.",
      "Update asset ownership, patch records, exception tracking, playbooks, and this CHASER Card with lessons learned from the hunt."
    ]
  },
  "llm_instructions": {
    "plain_language": "Hunt for evidence that Log4Shell was attempted or successful. Start with asset exposure, then look for suspicious inbound JNDI strings, outbound callbacks, and Java process/file activity.",
    "hunt_goal": "Determine whether vulnerable Log4j assets were exposed, targeted, or compromised.",
    "constraints": [
      "Read-only actions only.",
      "Do not perform exploitation or active scanning unless a configured tool explicitly supports safe inventory lookup.",
      "Correlate evidence before labeling a host compromised."
    ],
    "report_expectations": [
      "Exposure summary",
      "Attempted exploitation evidence",
      "Callback evidence",
      "Host execution evidence",
      "Telemetry gaps",
      "Recommended disposition"
    ],
    "hunt_guidance": {
      "what_to_look_for": "Inbound requests containing a JNDI lookup string (e.g. ${jndi:ldap://...}, ${jndi:rmi://...}, ${jndi:dns://...} or obfuscated/encoded variants) logged by a Java application running vulnerable log4j-core, followed by an outbound LDAP/RMI/DNS/HTTP callback or anomalous Java child-process execution from that server.",
      "key_entities": [
        "source IP and ASN/geo of the requester",
        "target host / application server",
        "request URL, URI, HTTP header (User-Agent, X-Api-Version, Referer), and POST body fields carrying the JNDI string",
        "callback destination IP/domain and protocol (LDAP, RMI, DNS, HTTP)",
        "Java process (java/javaw) and its child processes",
        "service account the application runs as",
        "dropped file paths and webshell artifacts"
      ],
      "indicators": [
        "request fields containing ${jndi:ldap://, ${jndi:rmi://, ${jndi:dns://, ${jndi:iiop://, or ${jndi:nis://",
        "obfuscated JNDI payloads such as ${${::-j}${::-n}${::-d}${::-i}:...} or ${lower:j}ndi and URL/Base64-encoded variants like %24%7Bjndi or jndi%3A",
        "nested log4j lookups (${env:}, ${sys:}, ${lower:}, ${upper:}) used to exfiltrate data via the callback hostname",
        "outbound LDAP (389/636), RMI (1099), or unexpected DNS/HTTP callbacks originating from an internet-facing application server to an external or hosting/VPS address",